<?xml version="1.0" encoding="UTF-8"?>
<thememeta xmlns:xsi="http://www.w3.org/2001/XMLSchema-instance"
	xsi:schemaLocation="http://fbsplash.berlios.de/schemas/1.0/thememeta.xsd">
	<name>gentoo-livecd</name>
	<version>2007.0</version>
	<author>
		<name>blackace</name>
		<email>blackace@gentoo.org</email>
	</author>
	<description>A fbsplash theme created and designed for the Gentoo Linux 2007.0 release.</description>
	<license>Artistic</license>
	<url>http://www.gentoo.org/</url>
</thememeta>

